<?xml version="1.0" encoding="UTF-8"?>
<dataroot xmlns:od="urn:schemas-microsoft-com:officedata" xmlns:xsi="http://www.w3.org/2001/XMLSchema-instance"  xsi:noNamespaceSchemaLocation="81_Agents.xsd" generated="2024-10-08T11:26:44">
<_x0038_1_Agents>
<AgentID>1</AgentID>
<AgentName>Chorpita &amp; Spence</AgentName>
</_x0038_1_Agents>
<_x0038_1_Agents>
<AgentID>2</AgentID>
<AgentName>Chorpita &amp; Becker</AgentName>
</_x0038_1_Agents>
<_x0038_1_Agents>
<AgentID>3</AgentID>
<AgentName>Caplan NIH R16 Early Intervention Team</AgentName>
</_x0038_1_Agents>
<_x0038_1_Agents>
<AgentID>5</AgentID>
<AgentName>Ebesutani et al. 2012</AgentName>
<Associated_x0020_DOI>https://doi.org/10.1037/a0027283</Associated_x0020_DOI>
</_x0038_1_Agents>
<_x0038_1_Agents>
<AgentID>6</AgentID>
<AgentName>Ebesutani et al. 2010</AgentName>
<Associated_x0020_DOI>https://doi.org/10.1007/s10802-009-9363-8</Associated_x0020_DOI>
</_x0038_1_Agents>
<_x0038_1_Agents>
<AgentID>7</AgentID>
<AgentName>RCADS Team</AgentName>
</_x0038_1_Agents>
<_x0038_1_Agents>
<AgentID>8</AgentID>
<AgentName>Park et al. 2016</AgentName>
<Associated_x0020_DOI>10.1007/s10862-015-9517-7</Associated_x0020_DOI>
</_x0038_1_Agents>
</dataroot>
